{"v":2,"msg_id":"22222222-2222-4222-8222-222222222222","origin_device":"dev-a","type":"call.state","canon_id":"call:11111111-1111-4111-8111-111111111111","sequence":1,"created_at":1000,"expires_at":2000,"payload":{"call_session_id":"11111111-1111-4111-8111-111111111111","state":"ringing","direction":"incoming"}}
