{
  "v": 2,
  "msg_id": "33333333-3333-4333-8333-333333333333",
  "origin_device": "mirror-device",
  "type": "call.control.invoke",
  "created_at": 1788267348000,
  "expires_at": 1788267363000,
  "payload": {
    "invocation_id": "2a846785-e576-47d0-8c4b-e4fba30d88bd",
    "canon_id": "call:11111111-1111-4111-8111-111111111111",
    "call_session_id": "11111111-1111-4111-8111-111111111111",
    "call_sequence": 2,
    "control_id": "2a846785-e576-47d0-8c4b-e4fba30d88bd",
    "kind": "answer",
    "invoked_at": 1788267348000
  }
}
