{
  "v": 2,
  "msg_id": "22222222-2222-4222-8222-222222222223",
  "origin_device": "origin-device",
  "type": "call.state",
  "canon_id": "call:11111111-1111-4111-8111-111111111111",
  "sequence": 2,
  "created_at": 1788267348000,
  "expires_at": 1788267358000,
  "payload": {
    "call_session_id": "11111111-1111-4111-8111-111111111111",
    "state": "ringing",
    "direction": "incoming",
    "controls": [
      {
        "control_id": "2a846785-e576-47d0-8c4b-e4fba30d88bd",
        "kind": "answer"
      },
      {
        "control_id": "0d47171d-c1ae-463a-bae7-3e8778517c0f",
        "kind": "decline"
      }
    ]
  }
}
