{
  "v": 2,
  "msg_id": "8ac240b7-8b89-4b41-80bf-d96424c654ec",
  "origin_device": "mirror-device",
  "type": "notif.action.invoke",
  "created_at": 1788267348000,
  "expires_at": 1788267468000,
  "payload": {
    "invocation_id": "fd2fb70b-829a-4701-8956-61611bc9c701",
    "canon_id": "origin-device:com.example.chat:42:thread-7",
    "action_id": "b6d3142a-e936-4d7d-b15a-bdf318bb0539",
    "notification_sequence": 17,
    "reply_text": "On my way",
    "invoked_at": 1788267348000
  }
}
