{
  "v": 2,
  "msg_id": "22222222-2222-4222-8222-222222222222",
  "origin_device": "dev-b",
  "type": "peer.receipt",
  "created_at": 1786267349000,
  "expires_at": 1786353749000,
  "payload": {
    "acked_msg_id": "11111111-1111-4111-8111-111111111111",
    "envelope_sha256": "0123456789abcdef0123456789abcdef0123456789abcdef0123456789abcdef",
    "status": "expired"
  }
}
